{
  "$schema": "./schema.json",
  "version": 1,
  "generated_at": "2026-01-11T17:00:00Z",
  "colors": {
    "background": {
      "primary": "#f6f7fb",
      "card": "#ffffff",
      "chip": "#f1f5f9"
    },
    "text": {
      "primary": "#1f2933",
      "muted": "#64748b",
      "chip": "#0f172a"
    },
    "border": {
      "default": "#e3e8f4"
    },
    "status": {
      "ready": "#0f9960",
      "review": "#d9822b",
      "draft": "#7b8794"
    },
    "theme": {
      "light": {
        "background": "#0f1115",
        "text": "#e6e6e6"
      },
      "brand": {
        "background": "#0d1313",
        "text": "#e6fffb"
      },
      "dark": {
        "background": "#0b0b0c",
        "text": "#ddd"
      }
    },
    "dark": {
      "background": {
        "primary": "#0f172a",
        "card": "#15213b",
        "chip": "rgba(148, 163, 184, 0.15)"
      },
      "text": {
        "primary": "#f8fafc",
        "muted": "#a5b4fc",
        "chip": "#e2e8f0"
      },
      "border": {
        "default": "rgba(148, 163, 184, 0.2)"
      }
    }
  },
  "typography": {
    "fontFamily": {
      "primary": "Inter, Segoe UI, system-ui, -apple-system, sans-serif",
      "system": "system-ui, -apple-system, Segoe UI, Roboto"
    },
    "fontSize": {
      "xs": "0.75rem",
      "sm": "0.875rem",
      "base": "1rem",
      "lg": "1.125rem",
      "xl": "1.25rem",
      "2xl": "1.5rem",
      "3xl": "1.875rem",
      "4xl": "2.25rem"
    },
    "fontWeight": {
      "normal": "400",
      "medium": "500",
      "semibold": "600",
      "bold": "700"
    },
    "lineHeight": {
      "tight": "1.25",
      "normal": "1.5",
      "relaxed": "1.75"
    },
    "letterSpacing": {
      "tight": "-0.025em",
      "normal": "0",
      "wide": "0.025em",
      "wider": "0.4px"
    }
  },
  "spacing": {
    "xs": "0.25rem",
    "sm": "0.5rem",
    "md": "0.75rem",
    "base": "1rem",
    "lg": "1.5rem",
    "xl": "2rem",
    "2xl": "2.5rem",
    "3xl": "3rem",
    "4xl": "4rem"
  },
  "radius": {
    "none": "0",
    "sm": "6px",
    "base": "8px",
    "md": "10px",
    "lg": "12px",
    "xl": "16px",
    "full": "999px"
  },
  "shadow": {
    "sm": "0 1px 2px rgba(0, 0, 0, 0.05)",
    "base": "0 4px 12px rgba(102, 126, 234, 0.3)",
    "md": "0 10px 25px rgba(15, 23, 42, 0.08)",
    "lg": "0 12px 30px rgba(15, 23, 42, 0.4)",
    "xl": "0 20px 40px rgba(0, 0, 0, 0.15)"
  },
  "breakpoints": {
    "sm": "640px",
    "md": "768px",
    "lg": "1024px",
    "xl": "1280px",
    "2xl": "1536px"
  }
}
